{
  "$schema": "https://json-schema.org/draft/2020-12/schema",
  "$id": "https://mixcut.invalid/schemas/taxonomy.schema.json",
  "title": "taxonomy",
  "type": "object",
  "properties": {
    "schema_version": {
      "const": "1.0.0"
    },
    "entity": {
      "const": "taxonomy"
    },
    "is_fixture": {
      "type": "boolean"
    },
    "version": {
      "type": "string",
      "minLength": 1
    },
    "axes": {
      "type": "object",
      "properties": {
        "content": {
          "type": "array",
          "items": {
            "type": "object",
            "properties": {
              "id": {
                "type": "string",
                "minLength": 1
              },
              "label": {
                "type": "string",
                "minLength": 1
              }
            },
            "required": [
              "id",
              "label"
            ],
            "additionalProperties": false
          },
          "minItems": 1
        },
        "action": {
          "type": "array",
          "items": {
            "type": "object",
            "properties": {
              "id": {
                "type": "string",
                "minLength": 1
              },
              "label": {
                "type": "string",
                "minLength": 1
              }
            },
            "required": [
              "id",
              "label"
            ],
            "additionalProperties": false
          },
          "minItems": 1
        },
        "shot_size": {
          "type": "array",
          "items": {
            "type": "object",
            "properties": {
              "id": {
                "type": "string",
                "minLength": 1
              },
              "label": {
                "type": "string",
                "minLength": 1
              }
            },
            "required": [
              "id",
              "label"
            ],
            "additionalProperties": false
          },
          "minItems": 1
        },
        "risk": {
          "type": "array",
          "items": {
            "type": "object",
            "properties": {
              "id": {
                "type": "string",
                "minLength": 1
              },
              "label": {
                "type": "string",
                "minLength": 1
              }
            },
            "required": [
              "id",
              "label"
            ],
            "additionalProperties": false
          },
          "minItems": 1
        }
      },
      "required": [
        "content",
        "action",
        "shot_size",
        "risk"
      ],
      "additionalProperties": false
    },
    "blocking_risks": {
      "type": "array",
      "items": {
        "type": "string",
        "minLength": 1
      },
      "minItems": 0
    }
  },
  "required": [
    "schema_version",
    "entity",
    "is_fixture",
    "version",
    "axes",
    "blocking_risks"
  ],
  "additionalProperties": false
}
